{"format_version":1,"title":"Boundary","area":{"shape":"rectangle","length_m":30,"width_m":20,"label":"Area"},"frames":[{"id":"frame","title":"Frame","caption":"","objects":[{"kind":"player","x":5,"y":6,"colour":"white","label":"Player","short":"P","number":1,"angle":0,"width":2,"ball":true}],"arrows":[{"kind":"pass","points":[{"x":1,"y":2},{"x":3,"y":4}],"label":"Pass","sequence":1,"badge":{"x":2,"y":3}}],"areas":[{"id":"zone","label":"Zone","x":10,"y":10,"width":5,"height":5,"colour":"blue"}]}]}
