{
  "format_version": 1,
  "title": "Numeric double-largest-subnormal",
  "area": {
    "shape": "rectangle",
    "length_m": 2.225073858507201e-308,
    "width_m": 2.225073858507201e-308
  },
  "frames": [
    {
      "id": "numeric",
      "title": "Numeric fields",
      "objects": [
        {
          "kind": "goal",
          "x": 2.225073858507201e-308,
          "y": -2.225073858507201e-308,
          "width": 2.225073858507201e-308,
          "angle": 2.225073858507201e-308
        }
      ],
      "arrows": [
        {
          "kind": "pass",
          "points": [
            {
              "x": 2.225073858507201e-308,
              "y": -2.225073858507201e-308
            },
            {
              "x": 1,
              "y": 1
            }
          ],
          "badge": {
            "x": 2.225073858507201e-308,
            "y": -2.225073858507201e-308
          }
        }
      ],
      "areas": [
        {
          "label": "Small zone",
          "x": 2.225073858507201e-308,
          "y": -2.225073858507201e-308,
          "width": 2.225073858507201e-308,
          "height": 2.225073858507201e-308
        }
      ]
    }
  ]
}
